Index,Keyword,Tweets
0,cucumber,I too am a cucumber sometimes
1,cucumber,Swimming Sea Cucumber - Enypniastes eximia - Submarine Ride 2540 Feet By hankplank
2,cucumber,"Did you know that a recent, peer-reviewed study found that 🦠can survive plastic crate washing &amp; transfer…"
3,cucumber,": CT editorial staff is out here with some Larry-Boy level ish. Not the hero we wanted, and we’re not sure if he’ll fix any…"
4,cucumber,": CT editorial staff is out here with some Larry-Boy level ish. Not the hero we wanted, and we’re not sure if he’ll fix any…"
5,cucumber,: Greta watching you sit on a plastic dildo instead of a cucumber.
6,cucumber,: This little sea cucumber looks like it's camouflaged as a nudibranch. I imagine this guy looks different when it is bigger.…
7,cucumber,"Make it a ! Special today at is a &amp; Roasted Carrot Hummus Wrap with feta, cucum…"
8,cucumber,: Greta watching you sit on a plastic dildo instead of a cucumber.
9,cucumber,Dove cucumber melon &amp; cherry blossom from bath &amp; body works are my favs
10,cucumber,: Oh no those poor stupid people! 🤦‍️ Listen they had access to the same informati…
11,cucumber,: Greta watching you sit on a plastic dildo instead of a cucumber.
12,cucumber,": CT editorial staff is out here with some Larry-Boy level ish. Not the hero we wanted, and we’re not sure if he’ll fix any…"
13,cucumber,lime cucumber is a top 3 gatorade flavor
14,cucumber,"Adapt, Overcome, Achieve! cool as a cucumber!"
15,cucumber,: Greta watching you sit on a plastic dildo instead of a cucumber.
16,cucumber,Wc one is real cucumber help me out
17,cucumber,"There is a mutiny in the kitchen, cucumber claims that he is a pastel de nata."
18,cucumber,: Greta watching you sit on a plastic dildo instead of a cucumber.
19,cucumber,All Tim Hort*ns had to do was say they weren't supposed to be reindeer in the first place.
20,cucumber,they like cucumber for skincare i guess but not for like eating lmao
21,cucumber,"Today we have with Luis Aldrin playing your all-time favorite songs. And while you're at it, how about y…"
22,cucumber,": CT editorial staff is out here with some Larry-Boy level ish. Not the hero we wanted, and we’re not sure if he’ll fix any…"
23,cucumber,Ok a little child just smiled at me and now I want like ten
24,cucumber,"Have a headache? Here's a drink that will help: 3 mint leaves, 1/2 cucumber, 1/2 lemon and 1 cup filtered water."
25,cucumber,Cucumber that I ate on Wednesday is still in my system
26,cucumber,": : Police crack major case, arresting two and seizing 214 brown paws, 10 bear gallbladders,…"
27,cucumber,: When life gives lemons make CUCUMBER LIME out of it. Our interns picking LEMONS at KR Market for rupees ONE per lemon KR…
28,cucumber,": CT editorial staff is out here with some Larry-Boy level ish. Not the hero we wanted, and we’re not sure if he’ll fix any…"
29,cucumber,Your real cucumber
30,cucumber,I asked Aruji for a cucumber and they blushed. I just need one for my beauty mask...
31,cucumber,: Greta watching you sit on a plastic dildo instead of a cucumber.
32,cucumber,"This Easy Healthy Hummus is one of my favorite things to eat. No joke! It's so versatile, you can eat it as a snack…"
33,cucumber,I thought they love cucumber? There's always scene in a drama where they put cucumber on their faces
34,cucumber,"If you're looking for a nutrient dense Juice with a touch of fruit, Green with Envy is for you! It has 6 cups of k…"
35,cucumber,: Greta watching you sit on a plastic dildo instead of a cucumber.
36,cucumber,: Greta watching you sit on a plastic dildo instead of a cucumber.
37,cucumber,: commit lesbian arson
38,cucumber,"Not everyone can afford vibrator, if it wasn't for…"
39,cucumber,: Greta watching you sit on a plastic dildo instead of a cucumber.
